{
  "$schema": "https://json-schema.org/draft/2020-12/schema",
  "$id": "https://github.com/soramikan/lnako/package-system/schema/environment/v1",
  "type": "object",
  "required": ["schemaVersion", "lockSha256", "profile", "runtime", "packages"],
  "additionalProperties": false,
  "$defs": {
    "importDependencies": {
      "type": "array",
      "items": {
        "type": "object",
        "required": ["alias", "package"],
        "additionalProperties": false,
        "properties": {
          "alias": { "type": "string" },
          "package": { "type": "string" }
        }
      }
    }
  },
  "properties": {
    "schemaVersion": {
      "type": "integer",
      "const": 1
    },
    "lockSha256": {
      "$ref": "common.schema.json#/$defs/sha256Hash"
    },
    "profile": {
      "type": "string"
    },
    "runtime": {
      "$ref": "common.schema.json#/$defs/packageRuntimeName"
    },
    "mutablePaths": {
      "description": "sync 時点の mutable path 依存の内容 digest（lock input.mutablePaths の写し）。metadata-only 変更による環境陳腐化の検出に使う。",
      "type": "array",
      "items": {
        "type": "object",
        "required": ["path", "sha256"],
        "additionalProperties": false,
        "properties": {
          "path": { "type": "string" },
          "sha256": { "type": "string", "pattern": "^sha256:[0-9a-f]{64}$" }
        }
      }
    },
    "dependencies": {
      "$ref": "#/$defs/importDependencies"
    },
    "packages": {
      "type": "object",
      "additionalProperties": {
        "type": "object",
        "required": ["name", "version", "path"],
        "additionalProperties": false,
        "properties": {
          "name": { "$ref": "common.schema.json#/$defs/packageName" },
          "version": { "$ref": "common.schema.json#/$defs/semver" },
          "id": { "$ref": "common.schema.json#/$defs/packageId" },
          "path": { "type": "string" },
          "exports": {
            "type": "array",
            "items": { "$ref": "common.schema.json#/$defs/exportEntry" }
          },
          "dependencies": {
            "$ref": "#/$defs/importDependencies"
          },
          "commands": {
            "type": "array",
            "items": {
              "type": "object",
              "required": ["name"],
              "additionalProperties": false,
              "properties": {
                "name": { "type": "string" },
                "args": {
                  "type": "array",
                  "items": { "type": "string" }
                },
                "josi": {
                  "type": "array",
                  "items": { "type": "string" }
                },
                "fn": { "type": "string" },
                "variable": { "type": "boolean" },
                "async": { "type": "boolean" },
                "return": { "type": "string" }
              }
            }
          }
        }
      }
    }
  }
}
